id,name,description,price,stock,category_id,created_at,updated_at,brand,colors,gender,season,source,source_url,style_attrs,tags,colors_clean,season_clean,tags_clean,product_group,text_profile
361,Oversize napa deri ceket,"Klasik yakalı, tek sıra düğmeli blazer. İki düğme kapamalı. Vatkalı omuz yapısı.",22950.0,10,1,2026-03-24 18:40:28.678,2026-04-01 23:12:00.135304,Massimo Dutti,"[""Black""]",female,"[""spring"", ""autumn""]",massimo-dutti,https://www.massimodutti.com/tr/oversize-napa-deri-ceket-l04780640?pelement=57618689,"{""fit"": ""relaxed"", ""style"": [""minimal"", ""casual""], ""length"": ""mini"", ""volume"": ""medium"", ""subtype"": [""jacket""], ""material"": ""leather"", ""occasion"": [""daily"", ""weekend""], ""color_tone"": ""dark-neutral"", ""silhouette"": ""straight"", ""product_group"": ""outerwear"", ""layering_level"": ""moderate"", ""formality_level"": 2, ""outerwear_compatible"": false, ""compatible_categories"": [""lower"", ""upper"", ""shoes"", ""bag""]}","[""Outerwear"", ""Jacket"", ""Casual"", ""Short"", ""Leather""]",['black'],"['spring', 'autumn']","['outerwear', 'jacket', 'casual', 'short', 'leather']",jacket,"Ürün: Oversize napa deri ceket. Açıklama: Klasik yakalı, tek sıra düğmeli blazer. İki düğme kapamalı. Vatkalı omuz yapısı.. Marka: Massimo Dutti. Renkler: black. Etiketler: outerwear, jacket, casual, short, leather."
683,Kontrast toplu halka küpe,"Kontrast uyumlu top aplikeli, metal halka küpe. Arkası iğneli.",2750.0,10,11,2026-03-25 08:06:22.627,2026-04-01 23:44:41.860879,Massimo Dutti,"[""Silver"", ""gold""]",female,"[""summer"", ""spring"", ""autumn""]",massimo-dutti,https://www.massimodutti.com/tr/dokulu-emaye-yuzuk-seti-l04604740?pelement=57434018,"{""style"": [""minimal"", ""modern""], ""subtype"": [""earring""], ""occasion"": [""daily"", ""evening"", ""office""], ""color_tone"": [""gold"", ""silver""], ""product_group"": ""accessory"", ""formality_level"": 3, ""outerwear_compatible"": false, ""compatible_categories"": [""upper"", ""dress"", ""outerwear""]}","[""Accessories"", ""Earrings"", ""Office"", ""Gold"", ""Silver""]","['silver', 'gold']","['summer', 'spring', 'autumn']","['accessories', 'earrings', 'office', 'gold', 'silver']",earrings,"Ürün: Kontrast toplu halka küpe. Açıklama: Kontrast uyumlu top aplikeli, metal halka küpe. Arkası iğneli.. Marka: Massimo Dutti. Renkler: silver, gold. Etiketler: accessories, earrings, office, gold, silver."
812,Arkası açık topuklu ayakkabı,"Hafif platform tabanlı loafer. Bant geçişli maskülen tasarım, kolay giyim için dilsiz silüet.",1790.0,10,15,2026-03-25 10:07:39.21,2026-04-01 23:55:21.458243,Zara,"[""Brown""]",female,"[""spring"", ""autumn""]",N,https://www.zara.com/tr/tr/arkasi-acik-topuklu-ayakkabi-p12250710.html,"{""fit"": ""not_applicable"", ""style"": [""minimal"", ""office""], ""length"": ""not_applicable"", ""volume"": ""low"", ""subtype"": [""flat-shoes""], ""material"": ""leather"", ""occasion"": [""daily"", ""office"", ""weekend""], ""color_tone"": ""dark-neutral"", ""silhouette"": ""not_applicable"", ""product_group"": ""shoes"", ""layering_level"": ""not_applicable"", ""formality_level"": 3, ""outerwear_compatible"": false, ""compatible_categories"": [""upper"", ""lower"", ""dress"", ""bag"", ""accessory""]}","[""Shoes"", ""Sandal"", ""Heels"", ""Office"", ""Suede"", ""Chic""]",['brown'],"['spring', 'autumn']","['shoes', 'sandal', 'heels', 'office', 'suede', 'chic']",sandal,"Ürün: Arkası açık topuklu ayakkabı. Açıklama: Hafif platform tabanlı loafer. Bant geçişli maskülen tasarım, kolay giyim için dilsiz silüet.. Marka: Zara. Renkler: brown. Etiketler: shoes, sandal, heels, office, suede, chic."
362,Kısa süet deri ceket,"Rahat kesim overshirt ceket. Sivri yaka, göğüs ve yan cepli. Önden düğme kapamalı.",22950.0,10,1,2026-03-24 18:40:29.057,2026-04-01 23:12:00.135304,Massimo Dutti,"[""Red""]",female,"[""spring"", ""autumn""]",massimo-dutti,https://www.massimodutti.com/tr/k%C4%B1sa-suet-deri-ceket-l04776636?pelement=57154354,"{""fit"": ""fitted"", ""style"": [""minimal"", ""smart-casual""], ""length"": ""mini"", ""volume"": ""low"", ""subtype"": [""jacket""], ""material"": ""suede"", ""occasion"": [""daily"", ""evening"", ""weekend""], ""color_tone"": ""warm"", ""silhouette"": ""straight"", ""product_group"": ""outerwear"", ""layering_level"": ""moderate"", ""formality_level"": 3, ""outerwear_compatible"": false, ""compatible_categories"": [""lower"", ""upper"", ""shoes"", ""bag""]}","[""Outerwear"", ""Jacket"", ""Short"", ""Suede""]",['red'],"['spring', 'autumn']","['outerwear', 'jacket', 'short', 'suede']",jacket,"Ürün: Kısa süet deri ceket. Açıklama: Rahat kesim overshirt ceket. Sivri yaka, göğüs ve yan cepli. Önden düğme kapamalı.. Marka: Massimo Dutti. Renkler: red. Etiketler: outerwear, jacket, short, suede."
369,Kemer detaylı napa deri ceket,Dik yakalı teknik ceket. Fırtına kapaklı fermuar kapama. İşlevsel cepler.,25950.0,10,1,2026-03-24 18:40:30.256,2026-04-01 23:12:00.135304,Massimo Dutti,"[""Black""]",female,"[""spring"", ""autumn""]",massimo-dutti,https://www.massimodutti.com/tr/kemer-detayl%C4%B1-napa-deri-ceket-l04763623?pelement=57374893,"{""fit"": ""relaxed"", ""style"": [""minimal"", ""smart-casual""], ""length"": ""midi"", ""volume"": ""medium"", ""subtype"": [""jacket""], ""material"": ""leather"", ""occasion"": [""daily"", ""office"", ""weekend""], ""color_tone"": ""dark-neutral"", ""silhouette"": ""straight"", ""product_group"": ""outerwear"", ""layering_level"": ""moderate"", ""formality_level"": 4, ""outerwear_compatible"": false, ""compatible_categories"": [""lower"", ""upper"", ""shoes"", ""bag""]}","[""Outerwear"", ""Jacket"", ""Regular"", ""Leather"", ""Belted""]",['black'],"['spring', 'autumn']","['outerwear', 'jacket', 'regular', 'leather', 'belted']",jacket,"Ürün: Kemer detaylı napa deri ceket. Açıklama: Dik yakalı teknik ceket. Fırtına kapaklı fermuar kapama. İşlevsel cepler.. Marka: Massimo Dutti. Renkler: black. Etiketler: outerwear, jacket, regular, leather, belted."
18,Sivri burunlu topuklu çizme,Çizme tarzı ayakkabı. Üst kısmında metal tokalı şerit detayı. Gövde kısmında dikiş detayı. İnce yüksek topuklu. Yan tarafında fermuar kapatmalı. Sivri burunlu.,4990.0,10,15,2026-03-24 16:01:47.495,2026-03-28 14:20:23.7,Zara,"[""brown""]",female,"[""winter"", ""autumn""]",massimo-dutti,https://www.zara.com/tr/tr/tokali-topuklu-cizme-p12006610.html?v1=495698345&v2=2419175,"{""style"": [""chic"", ""weekend"", ""party""], ""material"": ""suede"", ""occasion"": [""evening""], ""product_group"": ""shoes"", ""compatible_categories"": [""upper"", ""outerwear"", ""lower"", ""bag"", ""accessory""]}","[""Footwear"", ""Boots"", ""Party"", ""Casual"", ""Chic"", ""Slim-fit"", ""Suede""]",['brown'],"['winter', 'autumn']","['footwear', 'boots', 'party', 'casual', 'chic', 'slim-fit', 'suede']",boots,"Ürün: Sivri burunlu topuklu çizme. Açıklama: Çizme tarzı ayakkabı. Üst kısmında metal tokalı şerit detayı. Gövde kısmında dikiş detayı. İnce yüksek topuklu. Yan tarafında fermuar kapatmalı. Sivri burunlu.. Marka: Zara. Renkler: brown. Etiketler: footwear, boots, party, casual, chic, slim-fit, suede."
367,Kısa süet deri bomber ceket,"Klasik yakalı, tek sıra düğmeli blazer. İki düğme kapamalı. Vatkalı omuz yapısı.",29950.0,10,1,2026-03-24 18:40:29.897,2026-04-01 23:12:00.135304,Massimo Dutti,"[""Mustard""]",female,"[""spring"", ""autumn""]",massimo-dutti,https://www.massimodutti.com/tr/k%C4%B1sa-suet-deri-bomber-ceket-l04782642?pelement=57884976,"{""fit"": ""relaxed"", ""style"": [""casual"", ""minimal""], ""length"": ""mini"", ""volume"": ""medium"", ""subtype"": [""jacket""], ""material"": ""suede"", ""occasion"": [""daily"", ""weekend""], ""color_tone"": ""warm"", ""silhouette"": ""straight"", ""product_group"": ""outerwear"", ""layering_level"": ""moderate"", ""formality_level"": 2, ""outerwear_compatible"": false, ""compatible_categories"": [""lower"", ""upper"", ""shoes"", ""bag""]}","[""Outerwear"", ""Jacket"", ""Casual"", ""School"", ""Short"", ""Suede""]",['mustard'],"['spring', 'autumn']","['outerwear', 'jacket', 'casual', 'school', 'short', 'suede']",jacket,"Ürün: Kısa süet deri bomber ceket. Açıklama: Klasik yakalı, tek sıra düğmeli blazer. İki düğme kapamalı. Vatkalı omuz yapısı.. Marka: Massimo Dutti. Renkler: mustard. Etiketler: outerwear, jacket, casual, school, short, suede."
564,Pamuklu teknik pantolon,"Orta belli, slim-fit pantolon. Kemer köprüleri, fermuarlı ve düğmeli kapama. Arkada fileto cepler.",3950.0,10,6,2026-03-24 19:57:45.123,2026-04-01 23:26:47.793575,Massimo Dutti,"[""Dark Navy"", ""Black""]",female,"[""spring"", ""autumn"", ""winter""]",massimo-dutti,https://www.massimodutti.com/tr/pamuklu-teknik-pantolon-l05067767?pelement=56718044,"{""fit"": ""straight"", ""style"": [""minimal"", ""smart-casual""], ""length"": ""maxi"", ""volume"": ""medium"", ""subtype"": [""trouser""], ""material"": ""cotton"", ""occasion"": [""daily"", ""office"", ""weekend""], ""color_tone"": ""neutral"", ""silhouette"": ""straight"", ""product_group"": ""lower"", ""layering_level"": ""not_applicable"", ""formality_level"": 3, ""outerwear_compatible"": false, ""compatible_categories"": [""upper"", ""outerwear"", ""shoes"", ""bag"", ""accessory""]}","[""Pants"", ""Office"", ""Regular"", ""Cotton""]","['dark navy', 'black']","['spring', 'autumn', 'winter']","['pants', 'office', 'regular', 'cotton']",pants,"Ürün: Pamuklu teknik pantolon. Açıklama: Orta belli, slim-fit pantolon. Kemer köprüleri, fermuarlı ve düğmeli kapama. Arkada fileto cepler.. Marka: Massimo Dutti. Renkler: dark navy, black. Etiketler: pants, office, regular, cotton."
678,Oval kemik güneş gözlüğü,"Oval kemik güneş gözlüğü. Spor, şık, tarz.",2750.0,10,11,2026-03-25 08:06:21.103,2026-04-01 23:44:41.860879,Massimo Dutti,"[""Black""]",female,"[""summer""]",massimo-dutti,https://www.bershka.com/tr/oval-kemik-g%C3%BCne%C5%9F-g%C3%B6zl%C3%BC%C4%9F%C3%BC-c0p206336849.html?colorId=800,"{""style"": [""minimal"", ""summer""], ""subtype"": [""jewelry"", ""sunglasses""], ""occasion"": [""daily"", ""summer""], ""color_tone"": ""cool"", ""product_group"": ""accessory"", ""formality_level"": 4, ""compatible_categories"": [""upper"", ""dress"", ""outerwear"", ""bag""]}","[""Accessories"", ""Sunglasses"", ""Casual"", ""Sport""]",['black'],['summer'],"['accessories', 'sunglasses', 'casual', 'sport']",sunglasses,"Ürün: Oval kemik güneş gözlüğü. Açıklama: Oval kemik güneş gözlüğü. Spor, şık, tarz.. Marka: Massimo Dutti. Renkler: black. Etiketler: accessories, sunglasses, casual, sport."
685,Fosil küpe,"Fitilli triko bere. Katlanabilir kenarlı, standart beden, ayarlanabilir kalıp.",2750.0,10,11,2026-03-25 08:06:23.29,2026-04-01 23:44:41.860879,Massimo Dutti,"[""Orange""]",female,"[""spring"", ""summer"", ""autumn"", ""winter""]",massimo-dutti,https://www.massimodutti.com/tr/fosil-kupe-l04605731?pelement=57441683,"{""fit"": ""not_applicable"", ""style"": [""minimal"", ""office""], ""length"": ""not_applicable"", ""volume"": ""low"", ""subtype"": [""jewelry""], ""material"": ""cotton"", ""occasion"": [""daily"", ""office"", ""evening""], ""color_tone"": ""warm"", ""silhouette"": ""not_applicable"", ""product_group"": ""accessory"", ""layering_level"": ""not_applicable"", ""formality_level"": 3, ""outerwear_compatible"": false, ""compatible_categories"": [""upper"", ""lower"", ""outerwear"", ""dress"", ""bag""]}","[""Accessories"", ""Earrings"", ""Chic"", ""Party"", ""Gold""]",['orange'],"['spring', 'summer', 'autumn', 'winter']","['accessories', 'earrings', 'chic', 'party', 'gold']",earrings,"Ürün: Fosil küpe. Açıklama: Fitilli triko bere. Katlanabilir kenarlı, standart beden, ayarlanabilir kalıp.. Marka: Massimo Dutti. Renkler: orange. Etiketler: accessories, earrings, chic, party, gold."
723,İnce büyük halka küpe,"İnce metal, açık ve büyük halka küpe. Arkası iğneli.",3450.0,10,11,2026-03-25 08:06:33.455,2026-04-01 23:51:50.329238,Massimo Dutti,"[""Silver""]",female,"[""spring"", ""summer"", ""autumn"", ""winter""]",massimo-dutti,https://www.zara.com/tr/tr/ince-buyuk-halka-kupe-p01856056.html?v1=537530557&v2=2418989,"{""style"": [""maximal"", ""party""], ""subtype"": [""jewelry"", ""earrings""], ""occasion"": [""party""], ""color_tone"": ""cold"", ""product_group"": ""accessory"", ""formality_level"": 3, ""compatible_categories"": [""upper"", ""dress"", ""outerwear"", ""bag""]}","[""Accessories"", ""Earrings"", ""Party"", ""Silver""]",['silver'],"['spring', 'summer', 'autumn', 'winter']","['accessories', 'earrings', 'party', 'silver']",earrings,"Ürün: İnce büyük halka küpe. Açıklama: İnce metal, açık ve büyük halka küpe. Arkası iğneli.. Marka: Massimo Dutti. Renkler: silver. Etiketler: accessories, earrings, party, silver."
439,Straight fit jeans,"Esnek denimden skinny jean. Yüksek belli, beş cep tasarımlı ve fermuar kapamalı.",3450.0,10,7,2026-03-24 19:19:47.953,2026-04-01 23:21:01.444708,Massimo Dutti,"[""Light Blue""]",female,"[""spring"", ""autumn"", ""winter""]",massimo-dutti,https://www.massimodutti.com/tr/straight-fit-jeans-l05039937?pelement=60108762,"{""fit"": ""straight"", ""style"": [""minimal"", ""casual""], ""length"": ""maxi"", ""volume"": ""medium"", ""subtype"": [""jean""], ""material"": ""denim"", ""occasion"": [""daily"", ""weekend""], ""color_tone"": ""cool"", ""silhouette"": ""straight"", ""product_group"": ""lower"", ""layering_level"": ""not_applicable"", ""formality_level"": 2, ""outerwear_compatible"": false, ""compatible_categories"": [""upper"", ""outerwear"", ""shoes"", ""bag"", ""accessory""]}","[""Pants"", ""Denim"", ""Casual"", ""School"", ""Regular""]",['light blue'],"['spring', 'autumn', 'winter']","['pants', 'denim', 'casual', 'school', 'regular']",denim,"Ürün: Straight fit jeans. Açıklama: Esnek denimden skinny jean. Yüksek belli, beş cep tasarımlı ve fermuar kapamalı.. Marka: Massimo Dutti. Renkler: light blue. Etiketler: pants, denim, casual, school, regular."
574,Aplikeli düşük omuzlu top,"Metal aplike detaylı, düz kesim etek ucu, uzun kollu, düşük omuzlu, düz yaka top.",6550.0,10,4,2026-03-24 19:57:47.666,2026-04-01 23:26:47.793575,Massimo Dutti,"[""blue""]",female,"[""autumn"", ""winter""]",massimo-dutti,https://www.zara.com/tr/tr/tokali-yumusak-top-p00264304.html?v1=510810959,"{""fit"": ""slim"", ""style"": [""chic"", ""office""], ""length"": ""medium"", ""volume"": ""low"", ""subtype"": [""blouse""], ""material"": ""cotton"", ""occasion"": ""office"", ""color_tone"": ""cool"", ""silhouette"": ""straight"", ""product_group"": ""upper"", ""layering_level"": ""easy"", ""formality_level"": 4, ""outerwear_compatible"": true}","[""Topwear"", ""Blouse"", ""Chic"", ""Party"", ""Slim-fit"", ""Cotton""]",['blue'],"['autumn', 'winter']","['topwear', 'blouse', 'chic', 'party', 'slim-fit', 'cotton']",blouse,"Ürün: Aplikeli düşük omuzlu top. Açıklama: Metal aplike detaylı, düz kesim etek ucu, uzun kollu, düşük omuzlu, düz yaka top.. Marka: Massimo Dutti. Renkler: blue. Etiketler: topwear, blouse, chic, party, slim-fit, cotton."
686,Mini limon cam küpe,Klasik desenli dokuma atkı. Saçaklı kenar detayları. Oversize ölçüler.,2750.0,10,11,2026-03-25 08:06:23.821,2026-03-28 14:20:23.649,Massimo Dutti,"[""Silver"", ""Orange""]",female,"[""summer"", ""spring""]",massimo-dutti,https://www.massimodutti.com/tr/mini-limon-cam-kupe-l04605719?pelement=59909895,"{""note"": ""Manually re-categorized and color-tagged based on product name and description."", ""fixed_at"": ""2026-03-25T22:05:05.489Z"", ""inferred_colors"": [""other""], ""inferred_category"": ""summer_wear""}","[""Accessories"", ""Earrings"", ""Office"", ""Silver"", ""Textured""]","['silver', 'orange']","['summer', 'spring']","['accessories', 'earrings', 'office', 'silver', 'textured']",earrings,"Ürün: Mini limon cam küpe. Açıklama: Klasik desenli dokuma atkı. Saçaklı kenar detayları. Oversize ölçüler.. Marka: Massimo Dutti. Renkler: silver, orange. Etiketler: accessories, earrings, office, silver, textured."
284,Drapeli kruvaze yaka top,"Kruvaze yaka, uzun kollu top. Drapeli kumaş detayı. Düz etek ucu.",1950.0,10,4,2026-03-24 18:07:50.722,2026-04-01 23:04:27.782723,Massimo Dutti,"[""Black""]",female,"[""autumn"", ""spring"", ""winter""]",massimo-dutti,https://www.zara.com/tr/tr/drapeli-kruvaze-yaka-top-p05039224.html?v1=498720780&v2=2419905,"{""fit"": ""slim"", ""style"": [""chic"", ""smart-casual""], ""length"": ""medium"", ""volume"": ""low"", ""subtype"": [""blouse""], ""material"": ""cotton"", ""occasion"": [""daily"", ""evening"", ""weekend"", ""office""], ""color_tone"": ""dark"", ""silhouette"": ""straight"", ""product_group"": ""upper"", ""layering_level"": ""easy"", ""formality_level"": 4, ""outerwear_compatible"": true, ""compatible_categories"": [""lower"", ""shoes"", ""bag"", ""outerwear""]}","[""Topwear"", ""Blouse"", ""Office"", ""Chic"", ""Regular"", ""Silk""]",['black'],"['autumn', 'spring', 'winter']","['topwear', 'blouse', 'office', 'chic', 'regular', 'silk']",blouse,"Ürün: Drapeli kruvaze yaka top. Açıklama: Kruvaze yaka, uzun kollu top. Drapeli kumaş detayı. Düz etek ucu.. Marka: Massimo Dutti. Renkler: black. Etiketler: topwear, blouse, office, chic, regular, silk."
374,Kısa kürk mouton deri ceket,"Rahat kesim overshirt ceket. Sivri yaka, göğüs ve yan cepli. Önden düğme kapamalı.",79950.0,10,1,2026-03-24 18:40:32.427,2026-04-01 23:12:00.135304,Massimo Dutti,"[""Brown""]",female,"[""spring"", ""autumn""]",massimo-dutti,https://www.massimodutti.com/tr/k%C4%B1sa-kurk-mouton-deri-ceket-l04715545?pelement=57718608,"{""fit"": ""relaxed"", ""style"": [""evening"", ""minimal""], ""length"": ""mini"", ""volume"": ""high"", ""subtype"": [""jacket""], ""material"": ""velvet"", ""occasion"": [""evening"", ""party"", ""weekend""], ""color_tone"": ""dark-neutral"", ""silhouette"": ""straight"", ""product_group"": ""outerwear"", ""layering_level"": ""moderate"", ""formality_level"": 3, ""outerwear_compatible"": false, ""compatible_categories"": [""lower"", ""upper"", ""shoes"", ""bag""]}","[""Outerwear"", ""Coat"", ""School"", ""Casual"", ""Short"", ""Textured""]",['brown'],"['spring', 'autumn']","['outerwear', 'coat', 'school', 'casual', 'short', 'textured']",coats,"Ürün: Kısa kürk mouton deri ceket. Açıklama: Rahat kesim overshirt ceket. Sivri yaka, göğüs ve yan cepli. Önden düğme kapamalı.. Marka: Massimo Dutti. Renkler: brown. Etiketler: outerwear, coat, school, casual, short, textured."
569,Metalik iplikli halter top,"Sırtı açık, metalik iplikli kumaş detaylı halter top.",6950.0,10,4,2026-03-24 19:57:46.497,2026-04-01 23:26:47.793575,Massimo Dutti,"[""Brown""]",female,"[""spring"", ""autumn"", ""summer""]",massimo-dutti,https://www.zara.com/tr/tr/metalik-iplikli-halter-top-p02756035.html?v1=509526640&v2=2419930,"{""fit"": ""slim"", ""style"": ""party"", ""length"": ""medium"", ""volume"": ""low"", ""subtype"": ""top"", ""material"": ""shiny"", ""occasion"": ""party"", ""color_tone"": ""dark"", ""silhouette"": ""straight"", ""product_group"": ""top"", ""layering_level"": ""difficult"", ""formality_level"": 3, ""outerwear_compatible"": false, ""compatible_categories"": [""lower"", ""shoes"", ""bag"", ""accessory""]}","[""Topwear"", ""Blouse"", ""Chic"", ""Party"", ""Slim-fit"", ""Textured""]",['brown'],"['spring', 'autumn', 'summer']","['topwear', 'blouse', 'chic', 'party', 'slim-fit', 'textured']",blouse,"Ürün: Metalik iplikli halter top. Açıklama: Sırtı açık, metalik iplikli kumaş detaylı halter top.. Marka: Massimo Dutti. Renkler: brown. Etiketler: topwear, blouse, chic, party, slim-fit, textured."
687,Metal parçalı kolye,Yumuşak deriden slim-fit eldiven. Ekstra sıcaklık için astarlı iç yüzey. Bilekte düğme detaylı.,3450.0,10,11,2026-03-25 08:06:24.124,2026-04-01 23:48:38.544342,Massimo Dutti,"[""Orange""]",female,"[""spring"", ""summer"", ""autumn"", ""winter""]",massimo-dutti,https://www.massimodutti.com/tr/metal-parcal%C4%B1-kolye-l04602728?pelement=56991599,"{""style"": [""minimal"", ""smart-casual""], ""volume"": ""low"", ""subtype"": [""jewelry"", ""earrings""], ""material"": ""metal"", ""occasion"": [""daily"", ""office""], ""color_tone"": ""warm"", ""product_group"": ""accessory"", ""formality_level"": 3, ""compatible_categories"": [""upper"", ""dress"", ""outerwear"", ""bag""]}","[""Accessories"", ""Necklace"", ""Casual"", ""Gold""]",['orange'],"['spring', 'summer', 'autumn', 'winter']","['accessories', 'necklace', 'casual', 'gold']",necklace,"Ürün: Metal parçalı kolye. Açıklama: Yumuşak deriden slim-fit eldiven. Ekstra sıcaklık için astarlı iç yüzey. Bilekte düğme detaylı.. Marka: Massimo Dutti. Renkler: orange. Etiketler: accessories, necklace, casual, gold."
575,Orta bel denim bermuda,"Kesik paçalı, kemer köprülü, beş cepli, gizli fermuarlı bermuda şort.",6550.0,10,6,2026-03-24 19:57:47.916,2026-04-01 23:27:39.725,Massimo Dutti,"[""Light Blue""]",female,"[""summer""]",massimo-dutti,https://www.massimodutti.com/tr/tokal%C4%B1-tak%C4%B1m-pantolon-l05075685?pelement=57722713,"{""fit"": ""straight"", ""style"": [""casual"", ""minimal""], ""length"": ""maxi"", ""volume"": ""medium"", ""subtype"": [""jean""], ""material"": ""denim"", ""occasion"": [""daily"", ""weekend""], ""color_tone"": ""cool"", ""silhouette"": ""straight"", ""product_group"": ""lower"", ""layering_level"": ""not_applicable"", ""formality_level"": 2, ""outerwear_compatible"": false, ""compatible_categories"": [""upper"", ""outerwear"", ""shoes"", ""bag"", ""accessory""]}","[""Pants"", ""Shorts"", ""Casual"", ""School"", ""Short"", ""Regular"", ""Denim""]",['light blue'],['summer'],"['pants', 'shorts', 'casual', 'school', 'short', 'regular', 'denim']",shorts,"Ürün: Orta bel denim bermuda. Açıklama: Kesik paçalı, kemer köprülü, beş cepli, gizli fermuarlı bermuda şort.. Marka: Massimo Dutti. Renkler: light blue. Etiketler: pants, shorts, casual, school, short, regular, denim."
689,Çerçevesiz güneş gözlüğü,Çerçevesiz pembe güneş gözlüğü. Tarz görünmek için.,4750.0,10,11,2026-03-25 08:06:24.492,2026-03-28 14:20:23.657,Massimo Dutti,"[""Silver"", ""pink""]",female,"[""summer""]",massimo-dutti,https://www.bershka.com/tr/%C3%A7er%C3%A7evesiz-g%C3%BCne%C5%9F-g%C3%B6zl%C3%BC%C4%9F%C3%BC-c0p206336859.html?colorId=902,"{""style"": [""minimal"", ""modern""], ""subtype"": [""jewelry"", ""sunglasses""], ""occasion"": [""daily""], ""color_tone"": ""pink"", ""product_group"": ""accessory"", ""formality_level"": 3, ""compatible_categories"": [""upper"", ""dress"", ""outerwear"", ""bag""]}","[""Accessories"", ""Sunglasses"", ""Casual"", ""Silver""]","['silver', 'pink']",['summer'],"['accessories', 'sunglasses', 'casual', 'silver']",sunglasses,"Ürün: Çerçevesiz güneş gözlüğü. Açıklama: Çerçevesiz pembe güneş gözlüğü. Tarz görünmek için.. Marka: Massimo Dutti. Renkler: silver, pink. Etiketler: accessories, sunglasses, casual, silver."
379,Çift taraflı suni deri ceket,"Çift taraflı, yaka detaylı, uzun kollu ceket. Çift biyeli ön cepli. Suni kürk ve suni süet kombineli kumaş. Önü düğme kapamalı.",32950.0,10,1,2026-03-24 18:40:33.866,2026-04-01 23:12:00.135304,Massimo Dutti,"[""Brown""]",female,"[""winter""]",massimo-dutti,https://www.zara.com/tr/tr/cift-tarafli-suni-deri-ceket-p08073327.html?v1=507142418,"{""fit"": ""relaxed"", ""style"": [""minimal"", ""smart-casual""], ""length"": ""maxi"", ""volume"": ""medium"", ""subtype"": [""coat""], ""material"": ""leather"", ""occasion"": [""daily"", ""weekend"", ""evening""], ""color_tone"": ""dark"", ""silhouette"": ""straight"", ""product_group"": ""outerwear"", ""layering_level"": ""moderate"", ""formality_level"": 4, ""outerwear_compatible"": false, ""compatible_categories"": [""lower"", ""upper"", ""shoes"", ""bag""]}","[""Outerwear"", ""Jacket"", ""Chic"", ""Short"", ""Leather"", ""Textured""]",['brown'],['winter'],"['outerwear', 'jacket', 'chic', 'short', 'leather', 'textured']",jacket,"Ürün: Çift taraflı suni deri ceket. Açıklama: Çift taraflı, yaka detaylı, uzun kollu ceket. Çift biyeli ön cepli. Suni kürk ve suni süet kombineli kumaş. Önü düğme kapamalı.. Marka: Massimo Dutti. Renkler: brown. Etiketler: outerwear, jacket, chic, short, leather, textured."
577,Keten ince çizgili geniş paça pantolon,"Düz paça kumaş pantolon. Kemer köprülü, orta bel. Yan cepler ve arkada biyeli cepler.",4750.0,10,6,2026-03-24 19:57:48.913,2026-04-01 23:27:39.725,Massimo Dutti,"[""Dark Blue""]",female,"[""spring"", ""autumn"", ""winter""]",massimo-dutti,https://www.massimodutti.com/tr/keten-ince-cizgili-genis-paca-pantolon-l05039339?pelement=58044750,"{""fit"": ""straight"", ""style"": [""minimal"", ""smart-casual""], ""length"": ""maxi"", ""volume"": ""medium"", ""subtype"": [""jean""], ""material"": ""denim"", ""occasion"": [""daily"", ""office"", ""weekend""], ""color_tone"": ""dark-neutral"", ""silhouette"": ""straight"", ""product_group"": ""lower"", ""layering_level"": ""not_applicable"", ""formality_level"": 3, ""outerwear_compatible"": false, ""compatible_categories"": [""upper"", ""outerwear"", ""shoes"", ""bag"", ""accessory""]}","[""Pants"", ""Office"", ""Regular"", ""Straight"", ""Cotton""]",['dark blue'],"['spring', 'autumn', 'winter']","['pants', 'office', 'regular', 'straight', 'cotton']",pants,"Ürün: Keten ince çizgili geniş paça pantolon. Açıklama: Düz paça kumaş pantolon. Kemer köprülü, orta bel. Yan cepler ve arkada biyeli cepler.. Marka: Massimo Dutti. Renkler: dark blue. Etiketler: pants, office, regular, straight, cotton."
