id,name,description,price,stock,category_id,created_at,updated_at,brand,colors,gender,season,source,source_url,style_attrs,tags,colors_clean,season_clean,tags_clean,product_group,text_profile
721,Serçe parmak yüzüğü seti,Hafif yapısal detaylarla zenginleştirilmiş rahat silüet. Sezon geçişleri için ideal.,2750.0,10,11,2026-03-25 08:06:32.676,2026-04-01 23:51:09.847522,Massimo Dutti,"[""Orange""]",female,"[""spring"", ""autumn""]",massimo-dutti,https://www.massimodutti.com/tr/serce-parmak-yuzugu-seti-l04604708?pelement=56718043,"{""style"": [""minimal"", ""office""], ""volume"": ""low"", ""subtype"": [""jewelry"", ""bracelet""], ""material"": ""metal"", ""occasion"": [""daily"", ""office"", ""evening""], ""color_tone"": ""warm"", ""product_group"": ""accessory"", ""formality_level"": 3, ""compatible_categories"": [""upper"", ""dress"", ""outerwear"", ""bag""]}","[""Accessories"", ""Ring"", ""Gold""]",['orange'],"['spring', 'autumn']","['accessories', 'ring', 'gold']",ring,"Ürün: Serçe parmak yüzüğü seti. Açıklama: Hafif yapısal detaylarla zenginleştirilmiş rahat silüet. Sezon geçişleri için ideal.. Marka: Massimo Dutti. Renkler: orange. Etiketler: accessories, ring, gold."
726,Dokulu kalın bilezik,Klasik desenli dokuma atkı. Saçaklı kenar detayları. Oversize ölçüler.,3950.0,10,11,2026-03-25 08:06:34.336,2026-04-01 23:51:50.329238,Massimo Dutti,"[""Silver""]",female,"[""spring"", ""autumn""]",massimo-dutti,https://www.massimodutti.com/tr/dokulu-kal%C4%B1n-bilezik-l04603732?pelement=57972799,"{""style"": [""minimal"", ""office""], ""volume"": ""low"", ""subtype"": [""jewelry"", ""earrings""], ""material"": ""metal"", ""occasion"": [""daily"", ""office"", ""evening""], ""color_tone"": ""cool"", ""product_group"": ""accessory"", ""formality_level"": 3, ""compatible_categories"": [""upper"", ""dress"", ""outerwear"", ""bag""]}","[""Accessories"", ""Bracelet"", ""Casual"", ""Silver"", ""Textured""]",['silver'],"['spring', 'autumn']","['accessories', 'bracelet', 'casual', 'silver', 'textured']",bracelet,"Ürün: Dokulu kalın bilezik. Açıklama: Klasik desenli dokuma atkı. Saçaklı kenar detayları. Oversize ölçüler.. Marka: Massimo Dutti. Renkler: silver. Etiketler: accessories, bracelet, casual, silver, textured."
15,Ajurlu V yaka triko kazak,"Dokulu örgü tasarım. Uzun kollu, manşetlerde ve alt kenarda ribana detaylı. Rahat kesim.",4750.0,10,12,2026-03-24 16:01:46.513,2026-03-28 14:20:23.555,Massimo Dutti,"[""White""]",female,"[""winter"", ""autumn""]",massimo-dutti,https://www.massimodutti.com/tr/ajurlu-v-yaka-triko-kazak-l05622820?pelement=60587463,"{""fit"": null, ""style"": [""formal""], ""material"": null, ""occasion"": [""evening""], ""extracted_at"": ""2026-03-25T22:54:19.133Z"", ""pairing_notes"": ""AI generated style analysis for Ajurlu V yaka triko kazak."", ""product_group"": ""upper"", ""compatible_categories"": [""pants"", ""jeans"", ""shorts"", ""skirt"", ""sneaker"", ""heel"", ""boot"", ""sandal"", ""bag"", ""jewelry"", ""jacket""]}","[""Topwear"", ""Sweater"", ""Casual"", ""School"", ""Office"", ""Oversize"", ""Wool""]",['white'],"['winter', 'autumn']","['topwear', 'sweater', 'casual', 'school', 'office', 'oversize', 'wool']",sweater,"Ürün: Ajurlu V yaka triko kazak. Açıklama: Dokulu örgü tasarım. Uzun kollu, manşetlerde ve alt kenarda ribana detaylı. Rahat kesim.. Marka: Massimo Dutti. Renkler: white. Etiketler: topwear, sweater, casual, school, office, oversize, wool."
229,Fiyonklu asimetrik kısa elbise,"Halter yaka, sırtı açık ve fiyonklu elbise. Arkası dantel kumaş kombinasyon detaylı. Asimetrik etek ucu. Arkası gizli düğmeler ile kapanır.",10550.0,10,14,2026-03-24 16:51:26.312,2026-04-01 23:00:13.872048,Massimo Dutti,"[""Brown""]",female,"[""spring"", ""autumn""]",massimo-dutti,https://www.massimodutti.com/tr/kemerli-midi-elbise--studio-l09113950?pelement=56871317,"{""fit"": ""relaxed"", ""style"": [""formal"", ""minimal""], ""length"": ""maxi"", ""volume"": ""medium"", ""subtype"": [""maxi""], ""material"": ""satin"", ""occasion"": [""formal"", ""evening""], ""color_tone"": ""soft-light"", ""silhouette"": ""straight"", ""product_group"": ""dress"", ""layering_level"": ""moderate"", ""formality_level"": 4, ""outerwear_compatible"": true, ""compatible_categories"": [""shoes"", ""bag"", ""accessory"", ""outerwear""]}","[""Dress"", ""Chic"", ""Mini"", ""Asymmetric"", ""Silk""]",['brown'],"['spring', 'autumn']","['dress', 'chic', 'mini', 'asymmetric', 'silk']",dress,"Ürün: Fiyonklu asimetrik kısa elbise. Açıklama: Halter yaka, sırtı açık ve fiyonklu elbise. Arkası dantel kumaş kombinasyon detaylı. Asimetrik etek ucu. Arkası gizli düğmeler ile kapanır.. Marka: Massimo Dutti. Renkler: brown. Etiketler: dress, chic, mini, asymmetric, silk."
413,Yaka detaylı şişme parka,Hafif yapısal detaylarla zenginleştirilmiş rahat silüet. Sezon geçişleri için ideal.,8950.0,10,1,2026-03-24 19:04:17.567,2026-04-01 23:17:10.66516,Massimo Dutti,"[""Brown""]",female,"[""winter""]",massimo-dutti,https://www.massimodutti.com/tr/yaka-detayl%C4%B1-sisme-parka-l06715115?pelement=58785000,"{""fit"": ""relaxed"", ""style"": [""casual"", ""minimal""], ""length"": ""midi"", ""volume"": ""medium"", ""subtype"": [""jacket""], ""material"": ""cotton"", ""occasion"": [""daily"", ""weekend""], ""color_tone"": ""dark-neutral"", ""silhouette"": ""straight"", ""product_group"": ""outerwear"", ""layering_level"": ""moderate"", ""formality_level"": 2, ""outerwear_compatible"": false, ""compatible_categories"": [""lower"", ""upper"", ""shoes"", ""bag""]}","[""Outerwear"", ""Jacket"", ""Regular"", ""Polyester""]",['brown'],['winter'],"['outerwear', 'jacket', 'regular', 'polyester']",jacket,"Ürün: Yaka detaylı şişme parka. Açıklama: Hafif yapısal detaylarla zenginleştirilmiş rahat silüet. Sezon geçişleri için ideal.. Marka: Massimo Dutti. Renkler: brown. Etiketler: outerwear, jacket, regular, polyester."
605,Örgülü napa deri çanta,Stüktürel omuz çantası. Mıknatıslı kapaklı kapama. İçte fermuarlı cep ve kart bölmeleri.,11950.0,10,10,2026-03-25 07:51:57.886,2026-04-01 23:36:41.115948,Massimo Dutti,"[""Brown"", ""Red""]",female,"[""spring"", ""summer"", ""autumn"", ""winter""]",massimo-dutti,https://www.massimodutti.com/tr/orgulu-napa-deri-canta-l06935607?pelement=57650682,"{""fit"": ""not_applicable"", ""style"": [""minimal"", ""office""], ""length"": ""not_applicable"", ""volume"": ""low"", ""subtype"": [""shoulder""], ""material"": ""leather"", ""occasion"": [""daily"", ""office"", ""evening""], ""color_tone"": ""dark-neutral"", ""silhouette"": ""straight"", ""product_group"": ""bag"", ""layering_level"": ""not_applicable"", ""formality_level"": 3, ""outerwear_compatible"": true, ""compatible_categories"": [""upper"", ""lower"", ""outerwear"", ""dress"", ""shoes""]}","[""Bags"", ""Textured"", ""Leather""]","['brown', 'red']","['spring', 'summer', 'autumn', 'winter']","['bags', 'textured', 'leather']",bags,"Ürün: Örgülü napa deri çanta. Açıklama: Stüktürel omuz çantası. Mıknatıslı kapaklı kapama. İçte fermuarlı cep ve kart bölmeleri.. Marka: Massimo Dutti. Renkler: brown, red. Etiketler: bags, textured, leather."
25,Uzun kollu body,Slim fit - bisiklet yaka - normal boy - uzun kollu Pamuklu iplik dokumasından üretilmiş t-shirt. Bisiklet yaka ve uzun kollu. Düz etek ucu.,3950.0,10,4,2026-03-24 16:01:49.27,2026-04-01 17:55:44.771226,Massimo Dutti,"[""White""]",female,"[""winter"", ""autumn""]",massimo-dutti,https://www.massimodutti.com/tr/k%C4%B1sa-keten-triko-h%C4%B1rka-l05733575?pelement=57594752,"{""fit"": ""straight"", ""style"": [""casual"", ""minimal""], ""length"": ""midi"", ""volume"": ""low"", ""subtype"": [""cardigan""], ""material"": ""knitwear"", ""occasion"": [""daily"", ""weekend""], ""color_tone"": ""warm"", ""silhouette"": ""straight"", ""product_group"": ""upper"", ""layering_level"": ""easy"", ""formality_level"": 1, ""outerwear_compatible"": true, ""compatible_categories"": [""lower"", ""shoes"", ""bag"", ""accessory"", ""outerwear""]}","[""Topwear"", ""T-shirt"", ""Casual"", ""Sport"", ""School"", ""Slim-fit"", ""Cotton""]",['white'],"['winter', 'autumn']","['topwear', 't-shirt', 'casual', 'sport', 'school', 'slim-fit', 'cotton']",t-shirt,"Ürün: Uzun kollu body. Açıklama: Slim fit - bisiklet yaka - normal boy - uzun kollu Pamuklu iplik dokumasından üretilmiş t-shirt. Bisiklet yaka ve uzun kollu. Düz etek ucu.. Marka: Massimo Dutti. Renkler: white. Etiketler: topwear, t-shirt, casual, sport, school, slim-fit, cotton."
76,Yaka detaylı çizgili dökümlü gömlek,Rahat overshirt stil. Açık yakalı ve uzun kollu. Göğüste yama cep detaylı.,4750.0,10,13,2026-03-24 16:15:05.303,2026-04-01 18:04:54.774387,Massimo Dutti,"[[""blue""]]",female,"[""spring"", ""summer""]",massimo-dutti,https://www.massimodutti.com/tr/yaka-detayl%C4%B1-cizgili-dokumlu-gomlek-l05124524?pelement=59100200,"{""fit"": ""oversized"", ""style"": ""formal"", ""length"": ""regular"", ""volume"": ""high"", ""subtype"": ""blouse"", ""material"": ""viscose"", ""occasion"": ""office"", ""color_tone"": ""dark-neutral"", ""silhouette"": ""straight"", ""product_group"": ""upper"", ""layering_level"": ""moderate"", ""formality_level"": 4, ""outerwear_compatible"": true, ""compatible_categories"": [""pants"", ""jeans"", ""skirt"", ""tailoring"", ""outerwear""]}","[""Topwear"", ""Shirt"", ""Office"", ""Cotton""]",['blue'],"['spring', 'summer']","['topwear', 'shirt', 'office', 'cotton']",shirt,"Ürün: Yaka detaylı çizgili dökümlü gömlek. Açıklama: Rahat overshirt stil. Açık yakalı ve uzun kollu. Göğüste yama cep detaylı.. Marka: Massimo Dutti. Renkler: blue. Etiketler: topwear, shirt, office, cotton."
609,Sedef efektli el çantası,"Sedef efektli, aplikeli, kumaş kese çanta. Çift sert saplı. Mıknatıslı düğme kapamalı.",10550.0,10,10,2026-03-25 07:51:59.389,2026-04-01 23:29:35.010367,Massimo Dutti,"[""white""]",female,"[""spring"", ""summer"", ""autumn"", ""winter""]",massimo-dutti,https://www.massimodutti.com/tr/catlak-gorunumlu-napa-deri-kapakl%C4%B1-canta-l06905654?pelement=56718091,"{""fit"": ""not_applicable"", ""style"": [""party""], ""length"": ""not_applicable"", ""volume"": ""medium"", ""subtype"": [""hand""], ""material"": ""suede"", ""occasion"": [""party"", ""weekend""], ""color_tone"": ""light-neutral"", ""silhouette"": ""straight"", ""product_group"": ""bag"", ""layering_level"": ""not_applicable"", ""formality_level"": 2, ""outerwear_compatible"": true, ""compatible_categories"": [""upper"", ""lower"", ""outerwear"", ""dress"", ""shoes""]}","[""Bags"", ""Party"", ""Gold"", ""Textured""]",['white'],"['spring', 'summer', 'autumn', 'winter']","['bags', 'party', 'gold', 'textured']",bags,"Ürün: Sedef efektli el çantası. Açıklama: Sedef efektli, aplikeli, kumaş kese çanta. Çift sert saplı. Mıknatıslı düğme kapamalı.. Marka: Massimo Dutti. Renkler: white. Etiketler: bags, party, gold, textured."
71,%100 pamuklu poplin gömlek,"Düğmeli yakalı, normal kesim Oxford gömlek. Göğüs cebi ve düğmeli manşetli uzun kollar.",3450.0,10,13,2026-03-24 16:15:04.529,2026-04-01 18:04:54.774387,Massimo Dutti,"[""White"", ""Sky Blue""]",female,"[""spring"", ""summer"", ""autumn""]",massimo-dutti,https://www.massimodutti.com/tr/100-pamuklu-poplin-gomlek-l05137637?pelement=60328762,"{""fit"": ""regular"", ""style"": ""formal"", ""length"": ""regular"", ""volume"": ""low"", ""subtype"": ""shirt"", ""material"": ""cotton"", ""occasion"": ""office"", ""color_tone"": ""white"", ""silhouette"": ""straight"", ""product_group"": ""upper"", ""layering_level"": ""easy"", ""formality_level"": 4, ""outerwear_compatible"": true, ""compatible_categories"": [""tailoring"", ""skirt"", ""pants"", ""outerwear""]}","[""Topwear"", ""Shirt"", ""Office"", ""School"", ""Casual"", ""Regular"", ""Cotton""]","['white', 'sky blue']","['spring', 'summer', 'autumn']","['topwear', 'shirt', 'office', 'school', 'casual', 'regular', 'cotton']",shirt,"Ürün: %100 pamuklu poplin gömlek. Açıklama: Düğmeli yakalı, normal kesim Oxford gömlek. Göğüs cebi ve düğmeli manşetli uzun kollar.. Marka: Massimo Dutti. Renkler: white, sky blue. Etiketler: topwear, shirt, office, school, casual, regular, cotton."
322,Yumuşak oversize kaban,"Katlı yakalı ve uzun kollu, kayışlı ve düğmeli dökümlü kaban. Biyeli ön cepli. Kruvaze düğmeli ön kapamalı.",8950.0,10,1,2026-03-24 18:30:00.54,2026-04-01 23:10:15.213154,Massimo Dutti,"[""Burgundy""]",female,"[""spring"", ""autumn""]",massimo-dutti,https://www.massimodutti.com/tr/k%C4%B1sa-pamuklu-pelerin-ceket-l06720170?pelement=60587998,"{""fit"": ""oversized"", ""style"": [""minimal"", ""smart-casual""], ""length"": ""maxi"", ""volume"": ""high"", ""subtype"": [""parka""], ""material"": ""cotton"", ""occasion"": [""daily"", ""office"", ""weekend""], ""color_tone"": ""dark-neutral"", ""silhouette"": ""straight"", ""product_group"": ""outerwear"", ""layering_level"": ""moderate"", ""formality_level"": 3, ""outerwear_compatible"": false, ""compatible_categories"": [""lower"", ""upper"", ""shoes"", ""bag""]}","[""Outerwear"", ""Coat"", ""Chic"", ""Formal"", ""Maxi"", ""Oversize"", ""Wool""]",['burgundy'],"['spring', 'autumn']","['outerwear', 'coat', 'chic', 'formal', 'maxi', 'oversize', 'wool']",coats,"Ürün: Yumuşak oversize kaban. Açıklama: Katlı yakalı ve uzun kollu, kayışlı ve düğmeli dökümlü kaban. Biyeli ön cepli. Kruvaze düğmeli ön kapamalı.. Marka: Massimo Dutti. Renkler: burgundy. Etiketler: outerwear, coat, chic, formal, maxi, oversize, wool."
416,Süet deri ceket,%100 deri ana kumaşlı ceket. Sivri yaka ve uzun kollu. Biyeli ön cepler. Farklı kumaşta iç astar. Düğmeli ön kapama.,6950.0,10,1,2026-03-24 19:04:18.942,2026-04-01 23:17:10.66516,Massimo Dutti,"[""Burgundy""]",female,"[""winter""]",massimo-dutti,https://www.massimodutti.com/tr/teknik-kumas-parka-l06738151?pelement=57972801,"{""fit"": ""relaxed"", ""style"": [""minimal"", ""casual""], ""length"": ""midi"", ""volume"": ""medium"", ""subtype"": [""jacket""], ""material"": ""cotton"", ""occasion"": [""daily"", ""weekend""], ""color_tone"": ""dark-neutral"", ""silhouette"": ""straight"", ""product_group"": ""outerwear"", ""layering_level"": ""moderate"", ""formality_level"": 2, ""outerwear_compatible"": false, ""compatible_categories"": [""lower"", ""upper"", ""shoes"", ""bag""]}","[""Outerwear"", ""Jacket"", ""Casual"", ""Short"", ""Suede""]",['burgundy'],['winter'],"['outerwear', 'jacket', 'casual', 'short', 'suede']",jacket,"Ürün: Süet deri ceket. Açıklama: %100 deri ana kumaşlı ceket. Sivri yaka ve uzun kollu. Biyeli ön cepler. Farklı kumaşta iç astar. Düğmeli ön kapama.. Marka: Massimo Dutti. Renkler: burgundy. Etiketler: outerwear, jacket, casual, short, suede."
20,Geniş bel örgü kazak,"Uzun kollu, dik yaka kazak. Geniş, beli oturan bel kısmı.",4750.0,10,12,2026-03-24 16:01:48.05,2026-03-28 14:20:23.56,Massimo Dutti,"[""Dark Blue""]",female,"[""winter"", ""autumn""]",massimo-dutti,https://www.zara.com/tr/tr/genis-bel-orgu-kazak-p03920167.html?v1=506034406,"{""note"": ""Manually re-categorized and color-tagged based on product name and description."", ""fixed_at"": ""2026-03-25T22:05:07.082Z"", ""inferred_colors"": [""white""], ""inferred_category"": ""knitwear""}","[""Topwear"", ""Sweater"", ""Casual"", ""School"", ""Regular"", ""Wool""]",['dark blue'],"['winter', 'autumn']","['topwear', 'sweater', 'casual', 'school', 'regular', 'wool']",sweater,"Ürün: Geniş bel örgü kazak. Açıklama: Uzun kollu, dik yaka kazak. Geniş, beli oturan bel kısmı.. Marka: Massimo Dutti. Renkler: dark blue. Etiketler: topwear, sweater, casual, school, regular, wool."
24,Pamuklu dökümlü triko kazak,Yuvarlak yaka örgü kazak. Ribanalı manşet ve alt kenar. Uzun kollu.,3950.0,10,12,2026-03-24 16:01:49.088,2026-04-01 17:55:44.771226,Massimo Dutti,"[""Dark Blue"", ""Brown""]",female,"[""winter"", ""autumn""]",massimo-dutti,https://www.massimodutti.com/tr/pamuklu-dokumlu-triko-kazak-l05614813?pelement=58357753,"{""fit"": ""oversized"", ""style"": [""smart-casual"", ""minimal""], ""length"": ""midi"", ""volume"": ""high"", ""subtype"": [""knitwear""], ""material"": ""knitwear"", ""occasion"": [""daily"", ""weekend"", ""office""], ""color_tone"": ""dark-neutral"", ""silhouette"": ""straight"", ""product_group"": ""upper"", ""layering_level"": ""moderate"", ""formality_level"": 2, ""outerwear_compatible"": true, ""compatible_categories"": [""lower"", ""shoes"", ""bag"", ""accessory"", ""outerwear""]}","[""Topwear"", ""Sweater"", ""Casual"", ""Office"", ""Regular"", ""Wool""]","['dark blue', 'brown']","['winter', 'autumn']","['topwear', 'sweater', 'casual', 'office', 'regular', 'wool']",sweater,"Ürün: Pamuklu dökümlü triko kazak. Açıklama: Yuvarlak yaka örgü kazak. Ribanalı manşet ve alt kenar. Uzun kollu.. Marka: Massimo Dutti. Renkler: dark blue, brown. Etiketler: topwear, sweater, casual, office, regular, wool."
441,Yüksek bel barrel fit jean,"Klasik beş cep tasarımlı düz paça jean. Orta bel, fermuarlı ve düğmeli kapama.",3950.0,10,7,2026-03-24 19:19:48.297,2026-04-01 23:21:01.444708,Massimo Dutti,"[""Light Blue""]",female,"[""spring"", ""autumn"", ""winter""]",massimo-dutti,https://www.massimodutti.com/tr/yuksek-bel-barrel-fit-jean-l05055955?pelement=59750380,"{""fit"": ""wide-leg"", ""style"": [""casual"", ""minimal""], ""length"": ""maxi"", ""volume"": ""high"", ""subtype"": [""jean""], ""material"": ""denim"", ""occasion"": [""daily"", ""weekend""], ""color_tone"": ""cool"", ""silhouette"": ""straight"", ""product_group"": ""lower"", ""layering_level"": ""not_applicable"", ""formality_level"": 2, ""outerwear_compatible"": false, ""compatible_categories"": [""upper"", ""outerwear"", ""shoes"", ""bag"", ""accessory""]}","[""Pants"", ""Denim"", ""Casual"", ""School"", ""Oversize""]",['light blue'],"['spring', 'autumn', 'winter']","['pants', 'denim', 'casual', 'school', 'oversize']",denim,"Ürün: Yüksek bel barrel fit jean. Açıklama: Klasik beş cep tasarımlı düz paça jean. Orta bel, fermuarlı ve düğmeli kapama.. Marka: Massimo Dutti. Renkler: light blue. Etiketler: pants, denim, casual, school, oversize."
549,Pensli şalvar pantolon,Kısa paça bol pantolon. Kemer köprülü ve fermuar kapamalı yüksek bel. Yan cepler.,6550.0,10,6,2026-03-24 19:57:41.969,2026-04-01 23:25:46.374577,Massimo Dutti,"[""Brown""]",female,"[""spring"", ""autumn"", ""winter""]",massimo-dutti,https://www.massimodutti.com/tr/pensli-salvar-pantolon-l05085772?pelement=57722710,"{""fit"": ""wide-leg"", ""style"": [""minimal"", ""casual""], ""length"": ""maxi"", ""volume"": ""high"", ""subtype"": [""jean""], ""material"": ""denim"", ""occasion"": [""daily"", ""weekend""], ""color_tone"": ""dark-neutral"", ""silhouette"": ""straight"", ""product_group"": ""lower"", ""layering_level"": ""not_applicable"", ""formality_level"": 2, ""outerwear_compatible"": false, ""compatible_categories"": [""upper"", ""outerwear"", ""shoes"", ""bag"", ""accessory""]}","[""Pants"", ""Oversize"", ""Office"", ""Cotton""]",['brown'],"['spring', 'autumn', 'winter']","['pants', 'oversize', 'office', 'cotton']",pants,"Ürün: Pensli şalvar pantolon. Açıklama: Kısa paça bol pantolon. Kemer köprülü ve fermuar kapamalı yüksek bel. Yan cepler.. Marka: Massimo Dutti. Renkler: brown. Etiketler: pants, oversize, office, cotton."
610,Orta boy napa deri çanta,"Taneli dokulu crossbody çanta. Fermuarlı kapama, ayarlanabilir ve çıkarılabilir askılı.",13950.0,10,10,2026-03-25 07:51:59.903,2026-04-01 23:29:35.010367,Massimo Dutti,"[""Black""]",female,"[""spring"", ""summer"", ""autumn"", ""winter""]",massimo-dutti,https://www.massimodutti.com/tr/orta-boy-napa-deri-canta-l06913630?pelement=56824293,"{""fit"": ""not_applicable"", ""style"": [""minimal"", ""office""], ""length"": ""not_applicable"", ""volume"": ""low"", ""subtype"": [""shoulder""], ""material"": ""leather"", ""occasion"": [""daily"", ""office""], ""color_tone"": ""dark-neutral"", ""silhouette"": ""straight"", ""product_group"": ""bag"", ""layering_level"": ""not_applicable"", ""formality_level"": 3, ""outerwear_compatible"": true, ""compatible_categories"": [""upper"", ""lower"", ""outerwear"", ""dress"", ""shoes""]}","[""Bags"", ""Leather""]",['black'],"['spring', 'summer', 'autumn', 'winter']","['bags', 'leather']",bags,"Ürün: Orta boy napa deri çanta. Açıklama: Taneli dokulu crossbody çanta. Fermuarlı kapama, ayarlanabilir ve çıkarılabilir askılı.. Marka: Massimo Dutti. Renkler: black. Etiketler: bags, leather."
525,Yanları dikişli ispanyol paça pantolon,"İçten düğmeli ve fermuarlı, çan paça, yanları belirgin dikişli pantolon.",3950.0,10,6,2026-03-24 19:57:36.398,2026-04-01 23:24:52.573829,Massimo Dutti,"[""Dark Brown""]",female,"[""spring"", ""autumn"", ""winter""]",massimo-dutti,https://www.zara.com/tr/tr/yanlari-dikisli-ispanyol-paca-pantolon-p01165030.html?v1=499211033,"{""fit"": ""relaxed"", ""style"": [""minimal"", ""casual""], ""length"": ""maxi"", ""volume"": ""medium"", ""subtype"": [""trouser""], ""material"": ""cotton"", ""occasion"": [""daily"", ""weekend""], ""color_tone"": ""neutral"", ""silhouette"": ""straight"", ""product_group"": ""lower"", ""layering_level"": ""not_applicable"", ""formality_level"": 2, ""outerwear_compatible"": false, ""compatible_categories"": [""upper"", ""outerwear"", ""shoes"", ""bag"", ""accessory""]}","[""Pants"", ""Cotton"", ""Office"", ""Casual"", ""Bootcut""]",['dark brown'],"['spring', 'autumn', 'winter']","['pants', 'cotton', 'office', 'casual', 'bootcut']",pants,"Ürün: Yanları dikişli ispanyol paça pantolon. Açıklama: İçten düğmeli ve fermuarlı, çan paça, yanları belirgin dikişli pantolon.. Marka: Massimo Dutti. Renkler: dark brown. Etiketler: pants, cotton, office, casual, bootcut."
730,Ayarlanabilir dokulu parçalı kolye,Klasik desenli dokuma atkı. Saçaklı kenar detayları. Oversize ölçüler.,2750.0,10,11,2026-03-25 08:06:36.441,2026-04-01 23:51:50.329238,Massimo Dutti,"[""Orange"", ""Silver""]",female,"[""spring"", ""summer"", ""autumn"", ""winter""]",massimo-dutti,https://www.massimodutti.com/tr/ayarlanabilir-dokulu-parcal%C4%B1-kolye-l04602732?pelement=57374886,"{""style"": [""minimal"", ""modern""], ""volume"": ""low"", ""subtype"": [""jewelry"", ""earrings""], ""material"": ""metal"", ""occasion"": [""daily"", ""evening"", ""party""], ""color_tone"": ""warm"", ""product_group"": ""accessory"", ""formality_level"": 4, ""compatible_categories"": [""upper"", ""dress"", ""outerwear"", ""bag""]}","[""Accessories"", ""Necklace"", ""Casual"", ""Gold"", ""Textured""]","['orange', 'silver']","['spring', 'summer', 'autumn', 'winter']","['accessories', 'necklace', 'casual', 'gold', 'textured']",necklace,"Ürün: Ayarlanabilir dokulu parçalı kolye. Açıklama: Klasik desenli dokuma atkı. Saçaklı kenar detayları. Oversize ölçüler.. Marka: Massimo Dutti. Renkler: orange, silver. Etiketler: accessories, necklace, casual, gold, textured."
616,Mini boncuk detaylı çanta,"Mini tote çanta. Üstten saplı, fermuarlı ana bölme. Çıkarılabilir omuz askılı.",8950.0,10,10,2026-03-25 07:52:02.173,2026-04-01 23:36:41.115948,Massimo Dutti,"[""Black""]",female,"[""summer"", ""spring"", ""autumn"", ""winter""]",massimo-dutti,https://www.massimodutti.com/tr/mini-boncuk-detayl%C4%B1-canta-l06938620?pelement=59284752,"{""fit"": ""not_applicable"", ""style"": [""party"", ""weekend""], ""length"": ""not_applicable"", ""volume"": ""medium"", ""subtype"": [""shoulder""], ""material"": ""leather"", ""occasion"": [""party"", ""evening""], ""color_tone"": ""dark-neutral"", ""silhouette"": ""straight"", ""product_group"": ""bag"", ""layering_level"": ""not_applicable"", ""formality_level"": 3, ""outerwear_compatible"": true, ""compatible_categories"": [""upper"", ""lower"", ""outerwear"", ""dress"", ""shoes""]}","[""Bags"", ""Chic"", ""Party"", ""Textured""]",['black'],"['summer', 'spring', 'autumn', 'winter']","['bags', 'chic', 'party', 'textured']",bags,"Ürün: Mini boncuk detaylı çanta. Açıklama: Mini tote çanta. Üstten saplı, fermuarlı ana bölme. Çıkarılabilir omuz askılı.. Marka: Massimo Dutti. Renkler: black. Etiketler: bags, chic, party, textured."
242,Barrel fit denim midi etek,"Yumuşak denimden rahat kesim jean. Orta belli, beş cepli yapı.",3950.0,10,8,2026-03-24 18:07:42.904,2026-04-01 23:00:13.872048,Massimo Dutti,"[""Natural""]",female,"[""spring"", ""autumn"", ""winter""]",massimo-dutti,https://www.massimodutti.com/tr/barrel-fit-denim-midi-etek-l05242942?pelement=58820018,"{""fit"": ""straight"", ""style"": [""minimal"", ""smart-casual""], ""length"": ""midi"", ""volume"": ""medium"", ""subtype"": [""skirt""], ""material"": ""denim"", ""occasion"": [""daily"", ""office""], ""color_tone"": ""soft-light"", ""silhouette"": ""straight"", ""product_group"": ""lower"", ""layering_level"": ""not_applicable"", ""formality_level"": 2, ""outerwear_compatible"": false, ""compatible_categories"": [""upper"", ""shoes"", ""bag"", ""accessory"", ""outerwear""]}","[""Skirt"", ""Casual"", ""Maxi"", ""Regular"", ""Denim""]",['natural'],"['spring', 'autumn', 'winter']","['skirt', 'casual', 'maxi', 'regular', 'denim']",long skirt,"Ürün: Barrel fit denim midi etek. Açıklama: Yumuşak denimden rahat kesim jean. Orta belli, beş cepli yapı.. Marka: Massimo Dutti. Renkler: natural. Etiketler: skirt, casual, maxi, regular, denim."
